{"sport":"Tennis","event":"Australian Open","date":"2013-01-20","people":[{"name":"Na Li","gender":"unknown"}],"text":"\n          \n            \n\t\t  AUSTRALIAN OPEN\n\t\t  \n\t\t  January 20, 2013\n\t\t  \n\t\t  Na Li\n\t\t  MELBOURNE, VICTORIA\n\t\t  N. LI/J. Goerges\r\n      7‑6, 6‑1\r\n    \r\n    THE MODERATOR:  Questions, please. \r\n    \r\n    Q.  Can you take us through the tiebreaker.  You were down.  What was going through your head?\r\n    NA LI:  I think this is more important.  If I lose in the tiebreak, maybe is another story.  And also I was 5‑3 down.  I mean, I didn't try to think about score.  Really think about, like, point by point. \r\n    When she has a set point and she missed the ball, I was turn, I was laughing little bit.  I was happy I'm still on the first set, you know.  After the first set, I think she was a breakdown little bit in the mind. \r\n    \r\n    Q.  So overall you're happy with your performance today?\r\n    NA LI:  Yeah, really looking forward for quarterfinal.  Is one and a half year.  Always lose in the fourth round.  So for me it's very important for today the match. \r\n    \r\n    Q.  How do you feel about playing Ivanovic or Radwanska?  Who do you prefer to play?\r\n    NA LI:  I just stay cool to see.  They are still play right now.  I don't know.  I mean, doesn't matter. \r\n    Always both are tough player, so for sure is a tough match, yeah. \r\n    \r\n    Q.  Can you talk about what you've done in your off time.  Yesterday Kei Nishikori went to make some sushi.  Have you done anything interesting in Melbourne?\r\n    NA LI:  No.  I just do normal.  Just one hour practice and then go back to hotel, enjoy my room.  Not do any special, yeah. \r\n    \r\n    FastScripts Transcript by ASAP Sports\r\n    \r\n    \r\n    \r\n                \n          ","interview":[{"question":"Can you take us through the tiebreaker. You were down. What was going through your head?","answer":"I think this is more important. If I lose in the tiebreak, maybe is another story. And also I was 5‑3 down. I mean, I didn't try to think about score. Really think about, like, point by point. When she has a set point and she missed the ball, I was turn, I was laughing little bit. I was happy I'm still on the first set, you know. After the first set, I think she was a breakdown little bit in the mind.","person":"Na Li"},{"question":"So overall you're happy with your performance today?","answer":"Yeah, really looking forward for quarterfinal. Is one and a half year. Always lose in the fourth round. So for me it's very important for today the match.","person":"Na Li"},{"question":"How do you feel about playing Ivanovic or Radwanska? Who do you prefer to play?","answer":"I just stay cool to see. They are still play right now. I don't know. I mean, doesn't matter. Always both are tough player, so for sure is a tough match, yeah.","person":"Na Li"},{"question":"Can you talk about what you've done in your off time. Yesterday Kei Nishikori went to make some sushi. Have you done anything interesting in Melbourne?","answer":"No. I just do normal. Just one hour practice and then go back to hotel, enjoy my room. Not do any special, yeah.","person":"Na Li"}]}