{"sport":"Tennis","event":"Australian Open","date":"2013-01-18","people":[{"name":"Kei Nishikori","gender":"male"}],"text":"\n          \n            \n\t\t  AUSTRALIAN OPEN\n\t\t  \n\t\t  January 18, 2013\n\t\t  \n\t\t  Kei Nishikori\n\t\t  MELBOURNE, VICTORIA\n\t\t  K. NISHIKORI/E. Donskoy\r\n  7‑6, 6‑2, 6‑3\r\n\r\nTHE MODERATOR:  Questions, please. \r\n\r\nQ.  You had a medical timeout for your ankle.  Is it okay?\r\nKEI NISHIKORI:  Yeah, it's good. \r\n\r\nQ.  You play either Ferrer or Baghdatis next.  You have a winning record against Ferrer but a losing record against Marcos.  Your thoughts on either?\r\nKEI NISHIKORI:  I mean, both is going to be tough opponent.  Ferrer is playing well.  He's always, you know, tough to play.  He gets every ball and not easy to beat.  But, you know, I beat him before. \r\nYeah, Marcos is also playing well.  You know, we were in same tournament, Brisbane.  I saw him playing well.  He beat my friends two days ago. \r\nYeah, it's gonna be tough. \r\n\r\nQ.  Nice to get revenge?\r\nKEI NISHIKORI:  Yeah, I hope so (smiling). \r\n\r\nQ.  There's a few Japanese players doing well this year.  Is there a lot of excitement back home?\r\nKEI NISHIKORI:  Yeah, it's good for Japanese tennis, for sure.  And I'm more happy that, yeah, Kimiko is doing well.  He [sic] just beat second seed doubles.  That's amazing how much she can play. \r\nBut, yeah, I mean, everything makes me, you know, happy, too.  And I'm one of them, too. \r\n\r\nQ.  How did you feel your level of performance was today, especially at a point in time in the tournament where you want to be building?\r\nKEI NISHIKORI:  I think I played well that important games.  It wasn't easy to play today with the winds.  The weather was nice.\r\nBut, yeah, like the last couple games played really well and more confidence coming to play. \r\nSo I think I'm in good shape. \r\n\r\nFastScripts Transcript by ASAP Sports\r\n\r\n\r\n\r\n            \n          ","interview":[{"question":"You had a medical timeout for your ankle. Is it okay?","answer":"Yeah, it's good.","person":"Kei Nishikori"},{"question":"You play either Ferrer or Baghdatis next. You have a winning record against Ferrer but a losing record against Marcos. Your thoughts on either?","answer":"I mean, both is going to be tough opponent. Ferrer is playing well. He's always, you know, tough to play. He gets every ball and not easy to beat. But, you know, I beat him before. Yeah, Marcos is also playing well. You know, we were in same tournament, Brisbane. I saw him playing well. He beat my friends two days ago. Yeah, it's gonna be tough.","person":"Kei Nishikori"},{"question":"Nice to get revenge?","answer":"Yeah, I hope so (smiling).","person":"Kei Nishikori"},{"question":"There's a few Japanese players doing well this year. Is there a lot of excitement back home?","answer":"Yeah, it's good for Japanese tennis, for sure. And I'm more happy that, yeah, Kimiko is doing well. He [sic] just beat second seed doubles. That's amazing how much she can play. But, yeah, I mean, everything makes me, you know, happy, too. And I'm one of them, too.","person":"Kei Nishikori"},{"question":"How did you feel your level of performance was today, especially at a point in time in the tournament where you want to be building?","answer":"I think I played well that important games. It wasn't easy to play today with the winds. The weather was nice.But, yeah, like the last couple games played really well and more confidence coming to play. So I think I'm in good shape.","person":"Kei Nishikori"}]}