{"sport":"Tennis","event":"Australian Open","date":"2013-01-18","people":[{"name":"Stanislas Wawrinka","gender":"male"}],"text":"\n          \n            \n\t\t  AUSTRALIAN OPEN\n\t\t  \n\t\t  January 18, 2013\n\t\t  \n\t\t  Stanislas Wawrinka\n\t\t  MELBOURNE, VICTORIA\n\t\t  S. WAWRINKA/S. Querrey\r\n  7‑6, 7‑5, 6‑4\r\n\r\nTHE MODERATOR:  Questions, please. \r\n\r\nQ.  What was the difference from your point of view?  What gave you the victory?\r\nSTANISLAS WAWRINKA:  First, I think I was playing very good.  That make a little bit the difference. \r\nBut, no, the condition was tough.  The court was really fast.  It was quite windy there.  It was not easy to control the ball. \r\nBut I think the difference is that I was always playing with my line.  I was always try to make some things with the ball, try to stay aggressive, try to make him play every ball, every shot, and try to push him to make the mistake. \r\nYou know, when you won a close set like 7‑6, 7‑5, then 6‑4, only smallest point make the difference.  And today I took the important point. \r\n\r\nQ.  Were you aware that was the last American in the tournament?\r\nSTANISLAS WAWRINKA:  You know, it's not my first problem.  I play at US Open and it was always the last American.  It's not the first time I play when it's the last American in a Grand Slam. \r\n\r\nQ.  Getting to become a habit?\r\nSTANISLAS WAWRINKA:  If I won, it's the most important. \r\n\r\nFastScripts Transcript by ASAP Sports\r\n\r\n\r\n\r\n            \n          ","interview":[{"question":"What was the difference from your point of view? What gave you the victory?","answer":"First, I think I was playing very good. That make a little bit the difference. But, no, the condition was tough. The court was really fast. It was quite windy there. It was not easy to control the ball. But I think the difference is that I was always playing with my line. I was always try to make some things with the ball, try to stay aggressive, try to make him play every ball, every shot, and try to push him to make the mistake. You know, when you won a close set like 7‑6, 7‑5, then 6‑4, only smallest point make the difference. And today I took the important point.","person":"Stanislas Wawrinka"},{"question":"Were you aware that was the last American in the tournament?","answer":"You know, it's not my first problem. I play at US Open and it was always the last American. It's not the first time I play when it's the last American in a Grand Slam.","person":"Stanislas Wawrinka"},{"question":"Getting to become a habit?","answer":"If I won, it's the most important.","person":"Stanislas Wawrinka"}]}