{"sport":"Tennis","event":"Australian Open","date":"2013-01-19","people":[{"name":"Jeremy Chardy","gender":"unknown"}],"text":"\n          \n            \n\t\t  AUSTRALIAN OPEN\n\t\t  \n\t\t  January 19, 2013\n\t\t  \n\t\t  Jeremy Chardy\n\t\t  MELBOURNE, VICTORIA\n\t\t  J. CHARDY/J. Del Potro\r\n  6‑3, 6‑3, 6‑7, 3‑6, 6‑3\r\n\r\nTHE MODERATOR:  Questions, please. \r\n\r\nQ.  What was deciding today in your favor for the match?\r\nJEREMY CHARDY:  I don't know.  I decided tactic before the match.  Since the first point to the last point, I play exactly the same.  I stay very calm, very focus.  That's why I win today. \r\n\r\nQ.  Is that your biggest success so far?\r\nJEREMY CHARDY:  I beat Murray last year in Cincinnati. \r\nBut here it's something more because Australian Open, third round, I play a top player.  It's a big win for me.  And maybe the best of my career. \r\n\r\nQ.  How does it feel? \r\nJEREMY CHARDY:  I'm so happy.  I just finished my match.  But I just so happy, I enjoyed it. \r\n\r\nQ.  You played terrific in the first and second sets.  In the third set when you lost the tiebreak, you said you stayed calm.  Did you feel maybe he was going to come back into the game?\r\nJEREMY CHARDY:  No, I don't want to think because if I start to think I lose for sure. \r\nI just focus on my tactic.  I was two set to one up, so I just have to continue my game.  I did it, so...  It was a good idea. \r\n\r\nQ.  What was your tactic today?\r\nJEREMY CHARDY:  My tactic was very simple:  I play slice with my backhand and I try to play short slice because like this he has to come in the court.  After, with my forehand, I can go full power, so... \r\nIt was nothing else (laughter). \r\n\r\nQ.  Were you worried in the third and fourth sets he would be more confident for the fifth set?\r\nJEREMY CHARDY:  I don't know.  I have a chance on every set, so...  It was very near every set.  Yeah, I don't know.  Every set I can win the set.  I just have to stay focus on my game.  When I get chance in the last one, I take it, so...  That's it. \r\n\r\nQ.  French players are becoming the story of this tournament.  There's guaranteed to be four in the fourth round now.  Is there any secret as to why French tennis is going so well at the moment?\r\nJEREMY CHARDY:  I don't know.  We have a lot of good player.  I think everybody start to play well this year.  So I don't know.  I don't know what is the thing. \r\nBut we just play good.  Maybe everybody win, so we want to fight more.  I don't know. \r\n\r\nQ.  Do you think one of the French players can go farther now and maybe even win? \r\nJEREMY CHARDY:  Which one? \r\n\r\nQ.  I don't know. \r\nJEREMY CHARDY:  I don't know.  Maybe me.  I don't know (smiling). \r\n\r\nQ.  Is it maybe for you easier to play not in front to have such a success compared to if you are playing in Roland Garros?\r\nJEREMY CHARDY:  I love to play in Roland Garros.  Always my family and my friend to come to watch my game in Roland Garros.  I always enjoy it. \r\nI already play very good in French Open.  So is still my best tournament.  I don't know.  I mean, maybe I will play better this year. \r\n\r\nFastScripts Transcript by ASAP Sports\r\n\r\n\r\n\r\n            \n          ","interview":[{"question":"What was deciding today in your favor for the match?","answer":"I don't know. I decided tactic before the match. Since the first point to the last point, I play exactly the same. I stay very calm, very focus. That's why I win today.","person":"Jeremy Chardy"},{"question":"Is that your biggest success so far?","answer":"I beat Murray last year in Cincinnati. But here it's something more because Australian Open, third round, I play a top player. It's a big win for me. And maybe the best of my career.","person":"Jeremy Chardy"},{"question":"How does it feel?","answer":"I'm so happy. I just finished my match. But I just so happy, I enjoyed it.","person":"Jeremy Chardy"},{"question":"You played terrific in the first and second sets. In the third set when you lost the tiebreak, you said you stayed calm. Did you feel maybe he was going to come back into the game?","answer":"No, I don't want to think because if I start to think I lose for sure. I just focus on my tactic. I was two set to one up, so I just have to continue my game. I did it, so... It was a good idea.","person":"Jeremy Chardy"},{"question":"What was your tactic today?","answer":"My tactic was very simple: I play slice with my backhand and I try to play short slice because like this he has to come in the court. After, with my forehand, I can go full power, so... It was nothing else (laughter).","person":"Jeremy Chardy"},{"question":"Were you worried in the third and fourth sets he would be more confident for the fifth set?","answer":"I don't know. I have a chance on every set, so... It was very near every set. Yeah, I don't know. Every set I can win the set. I just have to stay focus on my game. When I get chance in the last one, I take it, so... That's it.","person":"Jeremy Chardy"},{"question":"French players are becoming the story of this tournament. There's guaranteed to be four in the fourth round now. Is there any secret as to why French tennis is going so well at the moment?","answer":"I don't know. We have a lot of good player. I think everybody start to play well this year. So I don't know. I don't know what is the thing. But we just play good. Maybe everybody win, so we want to fight more. I don't know.","person":"Jeremy Chardy"},{"question":"Do you think one of the French players can go farther now and maybe even win?","answer":"Which one?","person":"Jeremy Chardy"},{"question":"I don't know.","answer":"I don't know. Maybe me. I don't know (smiling).","person":"Jeremy Chardy"},{"question":"Is it maybe for you easier to play not in front to have such a success compared to if you are playing in Roland Garros?","answer":"I love to play in Roland Garros. Always my family and my friend to come to watch my game in Roland Garros. I always enjoy it. I already play very good in French Open. So is still my best tournament. I don't know. I mean, maybe I will play better this year.","person":"Jeremy Chardy"}]}