{"sport":"Tennis","event":"Australian Open","date":"2013-01-20","people":[{"name":"Ekaterina Makarova","gender":"female"}],"text":"\n          \n            \n\t\t  AUSTRALIAN OPEN\n\t\t  \n\t\t  January 20, 2013\n\t\t  \n\t\t  Ekaterina Makarova\n\t\t  MELBOURNE, VICTORIA\n\t\t  E. MAKAROVA/A. Kerber\r\n      7‑5, 6‑4\r\n    \r\n    THE MODERATOR:  Questions, please. \r\n    \r\n    Q.  On television today the commentator said you were playing the best tennis of your life. \r\n    EKATERINA MAKAROVA:  Well, last year when I beat Serena, they asked me the same question.  So I think I played already a lot of matches with this tennis.  I really happy that I beat Kerber today because I lost three times last year against her. \r\n    So, yeah, I really glad about my match.  It was, I think, perfect.  Not all the match perfect, but most of the match. \r\n    I really enjoyed today.\r\n    \r\n    Q.  What can you say about playing Maria in the next round? \r\n    EKATERINA MAKAROVA:  I lost her quarters last year, so I think it's really interesting.  I really want to play against her. \r\n    During last year we played lot of times, and I never beat her.  So I'm really interesting to play against her.  She's in a good form now, in a good shape. \r\n    I hope I show my good tennis again.\r\n    \r\n    Q.  Are you friendly with her?\r\n    EKATERINA MAKAROVA:  It's tough question because she's living in America and I'm in Russia, so we didn't meet a lot of times. \r\n    But, yeah, we say hi and some few words. \r\n    \r\n    Q.  What gives you confidence that you'll be able to give her a good challenge?\r\n    EKATERINA MAKAROVA:  I think I'm in a good shape.  I played like three matches, yeah, and it was really tough match against Bartoli, long one. \r\n    So this one I think gives me a lot and it helps me today. \r\n    \r\n    Q.  You've had lots of success in Australia.  What do you put that down to?\r\n    EKATERINA MAKAROVA:  I don't know why, but I'm so comfortable to be here, so enjoying the city, stadium, everything. \r\n    I don't know, maybe it's the beginning of the year and you a little bit like want to play.  You rest couple months.  I'm so happy.  I'm enjoying to be here. \r\n    \r\n    Q.  Last year you came here you were playing very badly, right, in the fall?  I think you lost five or six first rounds before Australia last year. \r\n    EKATERINA MAKAROVA:  Yeah, yeah. \r\n    \r\n    Q.  Then you started playing well here.  Is it different coming this year; you're a little more confident starting the year?\r\n    EKATERINA MAKAROVA:  Like it was two years ago I lost before last Australian Open, not this one.  I think the last year was really good. \r\n    \r\n    Q.  What is it like knowing you're coming up against an opponent who has been just almost breezing past the people she's played so far in the tournament?\r\n    EKATERINA MAKAROVA:  You're asking about Sharapova? \r\n    \r\n    Q.  Yeah.  She's winning her games so easily, seemingly easily.  What is it like coming up against her?\r\n    EKATERINA MAKAROVA:  Well, she is the player like that.  She won a lot of matches easily because she is playing so aggressive, staying into the court. \r\n    I have some plan against her.  We played a lot of times so we know each other.  I think we'll be a good match and I try to show my best tennis.\r\n    \r\n    Q.  Are you confident you can destruct her?\r\n    EKATERINA MAKAROVA:  Yeah, I really interested and exciting to play this year against her. \r\n    \r\n    FastScripts Transcript by ASAP Sports\r\n    \r\n    \r\n    \r\n                \n          ","interview":[{"question":"On television today the commentator said you were playing the best tennis of your life.","answer":"Well, last year when I beat Serena, they asked me the same question. So I think I played already a lot of matches with this tennis. I really happy that I beat Kerber today because I lost three times last year against her. So, yeah, I really glad about my match. It was, I think, perfect. Not all the match perfect, but most of the match. I really enjoyed today.","person":"Ekaterina Makarova"},{"question":"What can you say about playing Maria in the next round?","answer":"I lost her quarters last year, so I think it's really interesting. I really want to play against her. During last year we played lot of times, and I never beat her. So I'm really interesting to play against her. She's in a good form now, in a good shape. I hope I show my good tennis again.","person":"Ekaterina Makarova"},{"question":"Are you friendly with her?","answer":"It's tough question because she's living in America and I'm in Russia, so we didn't meet a lot of times. But, yeah, we say hi and some few words.","person":"Ekaterina Makarova"},{"question":"What gives you confidence that you'll be able to give her a good challenge?","answer":"I think I'm in a good shape. I played like three matches, yeah, and it was really tough match against Bartoli, long one. So this one I think gives me a lot and it helps me today.","person":"Ekaterina Makarova"},{"question":"You've had lots of success in Australia. What do you put that down to?","answer":"I don't know why, but I'm so comfortable to be here, so enjoying the city, stadium, everything. I don't know, maybe it's the beginning of the year and you a little bit like want to play. You rest couple months. I'm so happy. I'm enjoying to be here.","person":"Ekaterina Makarova"},{"question":"Last year you came here you were playing very badly, right, in the fall? I think you lost five or six first rounds before Australia last year.","answer":"Yeah, yeah.","person":"Ekaterina Makarova"},{"question":"Then you started playing well here. Is it different coming this year; you're a little more confident starting the year?","answer":"Like it was two years ago I lost before last Australian Open, not this one. I think the last year was really good.","person":"Ekaterina Makarova"},{"question":"What is it like knowing you're coming up against an opponent who has been just almost breezing past the people she's played so far in the tournament?","answer":"You're asking about Sharapova?","person":"Ekaterina Makarova"},{"question":"Yeah. She's winning her games so easily, seemingly easily. What is it like coming up against her?","answer":"Well, she is the player like that. She won a lot of matches easily because she is playing so aggressive, staying into the court. I have some plan against her. We played a lot of times so we know each other. I think we'll be a good match and I try to show my best tennis.","person":"Ekaterina Makarova"},{"question":"Are you confident you can destruct her?","answer":"Yeah, I really interested and exciting to play this year against her.","person":"Ekaterina Makarova"}]}