{"sport":"Tennis","event":"Australian Open","date":"2013-01-22","people":[{"name":"Ekaterina Makarova","gender":"female"}],"text":"\n          \n            \n\t\t  AUSTRALIAN OPEN\n\t\t  \n\t\t  January 22, 2013\n\t\t  \n\t\t  Ekaterina Makarova\n\t\t  MELBOURNE, VICTORIA\n\t\t  M. SHARAPOVA/E. Makarova\r\n      6‑2, 6‑2\r\n    \r\n    THE MODERATOR:  Questions, please. \r\n    \r\n    Q.  What are your feelings or impressions from today's game?  You took more games off her than almost everyone else combined. \r\n    EKATERINA MAKAROVA:  Yeah, she's in a great shape.  She's playing unbelievable, so aggressive, and just in the right spot of the court.  It's really tough to play against her now. \r\n    I wanted to be a little bit faster.  I didn't really think that I moved that well today.  But she's, like, so great now, it was really tough.  And, yeah, in the end I just was fighting for the games, because in the end already I was thinking that, yeah, it's tough to beat her. \r\n    I just tried to get more games. \r\n    \r\n    Q.  What is it she's doing so well that's making her so dominant?\r\n    EKATERINA MAKAROVA:  I think she's feeling so good now because you should play so long try to get her back.  If you didn't play that long, so she just came into the court and played so aggressive one, two shots and finished. \r\n    Yeah, it's really tough.  She's great now. \r\n    \r\n    Q.  What was your approach to try to stop that?\r\n    EKATERINA MAKAROVA:  Well, I tried to play as long as I can, not too aggressive.  But my game, I think, today it was really tough to do that because she was a little bit faster than me. \r\n    \r\n    FastScripts Transcript by ASAP Sports\r\n    \r\n    \r\n    \r\n                \n          ","interview":[{"question":"What are your feelings or impressions from today's game? You took more games off her than almost everyone else combined.","answer":"Yeah, she's in a great shape. She's playing unbelievable, so aggressive, and just in the right spot of the court. It's really tough to play against her now. I wanted to be a little bit faster. I didn't really think that I moved that well today. But she's, like, so great now, it was really tough. And, yeah, in the end I just was fighting for the games, because in the end already I was thinking that, yeah, it's tough to beat her. I just tried to get more games.","person":"Ekaterina Makarova"},{"question":"What is it she's doing so well that's making her so dominant?","answer":"I think she's feeling so good now because you should play so long try to get her back. If you didn't play that long, so she just came into the court and played so aggressive one, two shots and finished. Yeah, it's really tough. She's great now.","person":"Ekaterina Makarova"},{"question":"What was your approach to try to stop that?","answer":"Well, I tried to play as long as I can, not too aggressive. But my game, I think, today it was really tough to do that because she was a little bit faster than me.","person":"Ekaterina Makarova"}]}