{"sport":"Tennis","event":"Australian Open","date":"2013-01-15","people":[{"name":"Di Wu","gender":"unknown"}],"text":"\n          \n            \n\t\t  AUSTRALIAN OPEN\n\t\t  \n\t\t  January 15, 2013\n\t\t  \n\t\t  Di Wu\n\t\t  MELBOURNE, VICTORIA\n\t\t  I. DODIG/D. Wu\r\n  7‑5, 4‑6, 6‑3, 6‑3\r\n\r\nTHE MODERATOR:  Questions, please. \r\n\r\nQ.  How did it feel to make history as the first male player in main draw?  Did you feel any extra pressure because of this? \r\nDI WU:  I been asked the question so many times.  I'm not nervous, but I think after so many times I'm pretty nervous now. \r\n\r\nQ.  Did you enjoy the support out there on the court?\r\nDI WU:  Of course.  Very enjoy.  First time I play here in the main draw, and then I just focus every shot, every point, and then I just very enjoying here. \r\n\r\nQ.  Were you happy with the way you played today? \r\nDI WU:  Really happy, but lost.  (Laughter.)\r\n\r\nQ.  Will you take confidence from winning a set against someone ranked more than 100 places above you? \r\nDI WU:  Even I lost, I can see the hopes ahead of me, so I will keep trying to do better next time. \r\n\r\nQ.  Did Li Na provide any advice before the match today? \r\nDI WU:  Not technically, but mentally.  Last night before I go to bed I get a text message from her.  She told me, Don't be nervous.  Don't think about tennis.  Just go to bed.\r\nYour answer will be tomorrow, not tonight.  So don't think about anything else.\r\n\r\nQ.  Have you set your target on qualifying for Roland Garros next?  Is that on the agenda? \r\nDI WU:  Of course I want to participate two Grand Slams in a row, but red clay is not my strongest surface.  So I will practice more on the surface.\r\nUnfortunately, coming up Davis Cup will play on clay, so I got a chance to practice. \r\n\r\nQ.  What has your new coach been helping you with specifically, and how important has he been to your game? \r\nDI WU:  You mean this match or in general? \r\n\r\nQ.  No, in general. \r\nDI WU:  We have been working together for almost one year.  We communicate very well, not only on the court, but off the court.  He has taught me a lot.  Even sometimes we have some conflict, we solve the problems very quickly and not lead to tomorrow.\r\n\r\nQ.  Your coach is French, right?\r\nDI WU:  Yeah. \r\n\r\nQ.  To follow this question, could you talk a little bit about him and about your relationship with him?  Are you very close with your coach? \r\nDI WU:  We actually very close.  He not only arranges schedule for me, but also playing every match for me.  We been like friends on tour. \r\n\r\nFastScripts Transcript by ASAP Sports\r\n\r\n\r\n\r\n            \n          ","interview":[{"question":"How did it feel to make history as the first male player in main draw? Did you feel any extra pressure because of this?","answer":"I been asked the question so many times. I'm not nervous, but I think after so many times I'm pretty nervous now.","person":"Di Wu"},{"question":"Did you enjoy the support out there on the court?","answer":"Of course. Very enjoy. First time I play here in the main draw, and then I just focus every shot, every point, and then I just very enjoying here.","person":"Di Wu"},{"question":"Were you happy with the way you played today?","answer":"Really happy, but lost. (Laughter.)","person":"Di Wu"},{"question":"Will you take confidence from winning a set against someone ranked more than 100 places above you?","answer":"Even I lost, I can see the hopes ahead of me, so I will keep trying to do better next time.","person":"Di Wu"},{"question":"Did Li Na provide any advice before the match today?","answer":"Not technically, but mentally. Last night before I go to bed I get a text message from her. She told me, Don't be nervous. Don't think about tennis. Just go to bed.Your answer will be tomorrow, not tonight. So don't think about anything else.","person":"Di Wu"},{"question":"Have you set your target on qualifying for Roland Garros next? Is that on the agenda?","answer":"Of course I want to participate two Grand Slams in a row, but red clay is not my strongest surface. So I will practice more on the surface.Unfortunately, coming up Davis Cup will play on clay, so I got a chance to practice.","person":"Di Wu"},{"question":"What has your new coach been helping you with specifically, and how important has he been to your game?","answer":"You mean this match or in general?","person":"Di Wu"},{"question":"No, in general.","answer":"We have been working together for almost one year. We communicate very well, not only on the court, but off the court. He has taught me a lot. Even sometimes we have some conflict, we solve the problems very quickly and not lead to tomorrow.","person":"Di Wu"},{"question":"Your coach is French, right?","answer":"Yeah.","person":"Di Wu"},{"question":"To follow this question, could you talk a little bit about him and about your relationship with him? Are you very close with your coach?","answer":"We actually very close. He not only arranges schedule for me, but also playing every match for me. We been like friends on tour.","person":"Di Wu"}]}