{"sport":"Tennis","event":"Australian Open","date":"2013-01-18","people":[{"name":"David Ferrer","gender":"male"}],"text":"\n          \n            \n\t\t  AUSTRALIAN OPEN\n\t\t  \n\t\t  January 18, 2013\n\t\t  \n\t\t  David Ferrer\n\t\t  MELBOURNE, VICTORIA\n\t\t  D. FERRER/M. Baghdatis\r\n  6‑4, 6‑2, 6‑3\r\n\r\nTHE MODERATOR:  Questions, please. \r\n\r\nQ.  You have Kei Nishikori next.  What do you have to do to beat him this time?\r\nDAVID FERRER:  Well, it's a very difficult match.  I will have to play very good for to beat him.  I will have to play similar like tonight:  consistent, solid. \r\nIt's going to be a very physic match, no?  Because he has a very good shots, very powered on all his shots.  So I will be fast in my legs, no? \r\n\r\nQ.  You've played in the Olympics last time, and the first time he beat you.  What kind of shots are uncomfortable for you?\r\nDAVID FERRER:  Every match is different.  It was in grass court, in Olympic Games, in another tournament. \r\nNow we are in 2013, so, you know, the tennis, one day you can play your best tennis and another day you can play your worst of tennis, no? \r\n\r\nQ.  Do you feel like you're playing your best tennis at the moment?\r\nDAVID FERRER:  No.  I am okay.  I am good.  Of course tonight it was my best match on this week.  I'm very happy for that.  For to win in three sets, Marcos, is difficult, no?  And I did. \r\n\r\nQ.  It's promising that you're building through the tournament. \r\nDAVID FERRER:  I repeat again.  Every match is different.  I am in a good moment.  I start very good the season.  Tonight I play very good. \r\nAfter tomorrow, I don't know what happen, no?  But I feel good, no?  Of course I won one tournament one week before and now I am in fourth round run, so good feeling, of course.\r\n\r\nQ.  Are you confident within yourself about how you're feeling?\r\nDAVID FERRER:  I am confidence for to will fight after tomorrow.  I am only focused with my next match against Nishikori.  Now I want to enjoy this moment, no?  I want to rest.  I want to be with my team. \r\nI am not thinking too much about the match after tomorrow.  After tomorrow I will be thinking about the match. \r\n\r\nQ.  It's a satisfying win against a difficult opponent.  You played some good tennis. \r\nDAVID FERRER:  Of course, I will have to play my best tennis for to beat him because he's a very great player.  He's younger player, and, of course, I think Kei is going to be a top 10 soon. \r\n\r\nQ.  Some players say center court feels slower than other years. \r\nDAVID FERRER:  Slower the court than other years?  Can you repeat the question? \r\n\r\nQ.  Some players say this surface is faster than last year.  Do you feel that way?\r\nDAVID FERRER:  Yeah, yeah, sure.  It's a little bit faster than other years.  But is normal.  Sometimes is slower; sometimes change the courts.  This year change a little bit, sure. \r\n\r\nQ.  Do you feel more pressure being the top Spaniard without Rafa here?\r\nDAVID FERRER:  No, of course I'm not.  I don't mind I am the No.1 of Spain or not.  I am only focused with myself and with my tennis, of course. \r\nRafael, no, is very important for us.  Is a good friend for me.  He's recovering soon, no? \r\n\r\nQ.  Have you been in contact with him?\r\nDAVID FERRER:  I talked two weeks ago when he had a virus.  But when I finish this tournament, of course I will talk with him.  And I know good news because he's going to be soon, no, in Chile and Brazil. \r\n\r\nFastScripts Transcript by ASAP Sports\r\n\r\n\r\n\r\n            \n          ","interview":[{"question":"You have Kei Nishikori next. What do you have to do to beat him this time?","answer":"Well, it's a very difficult match. I will have to play very good for to beat him. I will have to play similar like tonight: consistent, solid. It's going to be a very physic match, no? Because he has a very good shots, very powered on all his shots. So I will be fast in my legs, no?","person":"David Ferrer"},{"question":"You've played in the Olympics last time, and the first time he beat you. What kind of shots are uncomfortable for you?","answer":"Every match is different. It was in grass court, in Olympic Games, in another tournament. Now we are in 2013, so, you know, the tennis, one day you can play your best tennis and another day you can play your worst of tennis, no?","person":"David Ferrer"},{"question":"Do you feel like you're playing your best tennis at the moment?","answer":"No. I am okay. I am good. Of course tonight it was my best match on this week. I'm very happy for that. For to win in three sets, Marcos, is difficult, no? And I did.","person":"David Ferrer"},{"question":"It's promising that you're building through the tournament.","answer":"I repeat again. Every match is different. I am in a good moment. I start very good the season. Tonight I play very good. After tomorrow, I don't know what happen, no? But I feel good, no? Of course I won one tournament one week before and now I am in fourth round run, so good feeling, of course.","person":"David Ferrer"},{"question":"Are you confident within yourself about how you're feeling?","answer":"I am confidence for to will fight after tomorrow. I am only focused with my next match against Nishikori. Now I want to enjoy this moment, no? I want to rest. I want to be with my team. I am not thinking too much about the match after tomorrow. After tomorrow I will be thinking about the match.","person":"David Ferrer"},{"question":"It's a satisfying win against a difficult opponent. You played some good tennis.","answer":"Of course, I will have to play my best tennis for to beat him because he's a very great player. He's younger player, and, of course, I think Kei is going to be a top 10 soon.","person":"David Ferrer"},{"question":"Some players say center court feels slower than other years.","answer":"Slower the court than other years? Can you repeat the question?","person":"David Ferrer"},{"question":"Some players say this surface is faster than last year. Do you feel that way?","answer":"Yeah, yeah, sure. It's a little bit faster than other years. But is normal. Sometimes is slower; sometimes change the courts. This year change a little bit, sure.","person":"David Ferrer"},{"question":"Do you feel more pressure being the top Spaniard without Rafa here?","answer":"No, of course I'm not. I don't mind I am the No.1 of Spain or not. I am only focused with myself and with my tennis, of course. Rafael, no, is very important for us. Is a good friend for me. He's recovering soon, no?","person":"David Ferrer"},{"question":"Have you been in contact with him?","answer":"I talked two weeks ago when he had a virus. But when I finish this tournament, of course I will talk with him. And I know good news because he's going to be soon, no, in Chile and Brazil.","person":"David Ferrer"}]}