{"sport":"Tennis","event":"Australian Open","date":"2013-01-18","people":[{"name":"Nicolas Almagro","gender":"male"}],"text":"\n          \n            \n\t\t  AUSTRALIAN OPEN\n\t\t  \n\t\t  January 18, 2013\n\t\t  \n\t\t  Nicolas Almagro\n\t\t  MELBOURNE, VICTORIA\n\t\t  N. ALMAGRO/J. Janowicz\r\n  7‑6, 7‑6, 6‑1\r\n\r\nTHE MODERATOR:  Questions, please. \r\n\r\nQ.  The Lance Armstrong interview today, I was wondering what your thoughts are on drug testing in tennis?\r\nNICOLAS ALMAGRO:  I'm not going to say nothing because I didn't see nothing about that.  I want to see before to speak. \r\nI don't know what happened. \r\n\r\nQ.  My question is what about the authorities in tennis are doing. \r\nNICOLAS ALMAGRO:  You need to ask to someone better than me because I not going to say nothing.  Sorry.  It's a very important things, and I not going to talk. \r\nI thinks our sport is clear, is fair, and I won't believe that is the only thing I can say. \r\n\r\nFastScripts Transcript by ASAP Sports\r\n\r\n\r\n\r\n            \n          ","interview":[{"question":"The Lance Armstrong interview today, I was wondering what your thoughts are on drug testing in tennis?","answer":"I'm not going to say nothing because I didn't see nothing about that. I want to see before to speak. I don't know what happened.","person":"Nicolas Almagro"},{"question":"My question is what about the authorities in tennis are doing.","answer":"You need to ask to someone better than me because I not going to say nothing. Sorry. It's a very important things, and I not going to talk. I thinks our sport is clear, is fair, and I won't believe that is the only thing I can say.","person":"Nicolas Almagro"}]}