{"sport":"Tennis","event":"Australian Open","date":"2013-01-14","people":[{"name":"Kei Nishikori","gender":"male"}],"text":"\n          \n            \n\t\t  AUSTRALIAN OPEN\n\t\t  \n\t\t  January 14, 2013\n\t\t  \n\t\t  Kei Nishikori\n\t\t  MELBOURNE, VICTORIA\n\t\t  K. NISHIKORI/V. Hanescu\r\n  6‑7, 6‑3, 6‑1, 6‑3\r\n\r\nTHE MODERATOR:  Questions, please. \r\n\r\nQ.  Can you talk about your knee, how the knee feels now?  Are you completely... \r\nKEI NISHIKORI:  It feels good.\r\n\r\nQ.  No problems?\r\nKEI NISHIKORI:  Yeah.  I think no problem, you know.  I played four sets and it's fine, and it should be okay.\r\n\r\nQ.  But you did have a problem earlier this year? \r\nKEI NISHIKORI:  Yeah, I hurt it in Brisbane.  It was a little bit tendinitis under the knee.  I don't know how they call, but it's getting better. \r\nI saw the picture, took echo couple days ago, and show nothing.\r\nIt's good.\r\n\r\nQ.  You had a great tournament last year here.  Do you feel any pressure coming in this year to repeat your results or do better?\r\nKEI NISHIKORI:  Yeah, that is for sure.  I want to do well, of course. \r\nBut, yeah, one match at a time.  It's gonna be tough next round too, so try to play just one match at a time.  And if I can do well, that's good, but if not, you know, try to do well another slam. \r\n\r\nQ.  I'm not sure if you have noticed there will be a Chinese male player who is going to play in the main draw Grand Slam event tomorrow.  Do you also recall a little bit about your first time major men's draw experience?  Was it in Wimbledon in 2008?\r\nKEI NISHIKORI:  Was it US Open?  I don't remember. \r\n\r\nQ.  US Open? \r\nKEI NISHIKORI:  I don't remember. \r\n\r\nQ.  What was it like then?  How did you do at that time?  Did you feel the pressure, all the expectation from local media?\r\nKEI NISHIKORI:  Maybe he will because it's, you know, Australia.  It's kind of Asia group. \r\nBut, you know, he's playing well.  He's still young.  Nothing to lose for him, so he should play loose. \r\nAnd, you know, of course he want to win here, but if he does well, you know, then result will come.\r\nYeah, for me, first time I think, I don't know, US Open long time ago, but I didn't feel any pressure or I think nothing, you know.  Only thing was I wanted to challenge them.\r\nMy ranking was around top 100, so I had nothing to lose against these guys.  He should play, you know, what he feels.\r\n\r\nQ.  You had a lot of Japanese support out there.  Does this feel like your home Grand Slam tournament?\r\nKEI NISHIKORI:  Yeah, other than all the Grand Slam I feel more comfortable playing here.  It is, you know, almost Asia, Oceania, and you see the match today a lot of Japanese or Asia, you know, the people came up and I felt a lot of support. \r\nSo I feel really comfortable playing here.\r\n\r\nFastScripts Transcript by ASAP Sports\r\n\r\n\r\n\r\n            \n          ","interview":[{"question":"Can you talk about your knee, how the knee feels now? Are you completely...","answer":"It feels good.","person":"Kei Nishikori"},{"question":"No problems?","answer":"Yeah. I think no problem, you know. I played four sets and it's fine, and it should be okay.","person":"Kei Nishikori"},{"question":"But you did have a problem earlier this year?","answer":"Yeah, I hurt it in Brisbane. It was a little bit tendinitis under the knee. I don't know how they call, but it's getting better. I saw the picture, took echo couple days ago, and show nothing.It's good.","person":"Kei Nishikori"},{"question":"You had a great tournament last year here. Do you feel any pressure coming in this year to repeat your results or do better?","answer":"Yeah, that is for sure. I want to do well, of course. But, yeah, one match at a time. It's gonna be tough next round too, so try to play just one match at a time. And if I can do well, that's good, but if not, you know, try to do well another slam.","person":"Kei Nishikori"},{"question":"I'm not sure if you have noticed there will be a Chinese male player who is going to play in the main draw Grand Slam event tomorrow. Do you also recall a little bit about your first time major men's draw experience? Was it in Wimbledon in 2008?","answer":"Was it US Open? I don't remember.","person":"Kei Nishikori"},{"question":"US Open?","answer":"I don't remember.","person":"Kei Nishikori"},{"question":"What was it like then? How did you do at that time? Did you feel the pressure, all the expectation from local media?","answer":"Maybe he will because it's, you know, Australia. It's kind of Asia group. But, you know, he's playing well. He's still young. Nothing to lose for him, so he should play loose. And, you know, of course he want to win here, but if he does well, you know, then result will come.Yeah, for me, first time I think, I don't know, US Open long time ago, but I didn't feel any pressure or I think nothing, you know. Only thing was I wanted to challenge them.My ranking was around top 100, so I had nothing to lose against these guys. He should play, you know, what he feels.","person":"Kei Nishikori"},{"question":"You had a lot of Japanese support out there. Does this feel like your home Grand Slam tournament?","answer":"Yeah, other than all the Grand Slam I feel more comfortable playing here. It is, you know, almost Asia, Oceania, and you see the match today a lot of Japanese or Asia, you know, the people came up and I felt a lot of support. So I feel really comfortable playing here.","person":"Kei Nishikori"}]}