{"sport":"Tennis","event":"Australian Open","date":"2013-01-21","people":[{"name":"Maria Kirilenko","gender":"female"}],"text":"\n          \n            \n\t\t  AUSTRALIAN OPEN\n\t\t  \n\t\t  January 21, 2013\n\t\t  \n\t\t  Maria Kirilenko\n\t\t  MELBOURNE, VICTORIA\n\t\t  S. WILLIAMS/M. Kirilenko\r\n      6‑2, 6‑0\r\n    \r\n    THE MODERATOR:  Questions, please. \r\n    \r\n    Q.  Obviously Serena has been playing well for the last year.  Even for her, that was a good performance.  Did you feel there was anything you could do out there tonight?\r\n    MARIA KIRILENKO:  Well, I think I try to do something special tonight.  That's why was so many mistakes.  I just maybe had to play little bit more simple. \r\n    So that's it.  We didn't even have long points.  It was really difficult to get the rhythm, you know. \r\n    But it's okay.  It's happens.\r\n    \r\n    Q.  You felt like playing against her you had to do more?\r\n    MARIA KIRILENKO:  Yeah, I played like I want to play something unbelievable, every shot I want to do the good shot.  But sometimes you just have to play just simple, maybe just through the middle. \r\n    But actually when I played through the middle, then she started to make winners.  That's why maybe I was trying too much. \r\n    It wasn't my day today.\r\n    \r\n    Q.  She made 87% of her first serves. \r\n    MARIA KIRILENKO:  Exactly, yeah.  I remember only once I returned on the second serve. \r\n    \r\n    Q.  Have you ever played anyone who served as well as she did?\r\n    MARIA KIRILENKO:  Actually, I think she has like one of the best serves on tour.  That's why it's difficult to return, so... \r\n    \r\n    Q.  How surprised would you be if Serena didn't win the tournament?\r\n    MARIA KIRILENKO:  Well, I don't care now, to be honest.\r\n    \r\n    FastScripts Transcript by ASAP Sports\r\n    \r\n    \r\n    \r\n                \n          ","interview":[{"question":"Obviously Serena has been playing well for the last year. Even for her, that was a good performance. Did you feel there was anything you could do out there tonight?","answer":"Well, I think I try to do something special tonight. That's why was so many mistakes. I just maybe had to play little bit more simple. So that's it. We didn't even have long points. It was really difficult to get the rhythm, you know. But it's okay. It's happens.","person":"Maria Kirilenko"},{"question":"You felt like playing against her you had to do more?","answer":"Yeah, I played like I want to play something unbelievable, every shot I want to do the good shot. But sometimes you just have to play just simple, maybe just through the middle. But actually when I played through the middle, then she started to make winners. That's why maybe I was trying too much. It wasn't my day today.","person":"Maria Kirilenko"},{"question":"She made 87% of her first serves.","answer":"Exactly, yeah. I remember only once I returned on the second serve.","person":"Maria Kirilenko"},{"question":"Have you ever played anyone who served as well as she did?","answer":"Actually, I think she has like one of the best serves on tour. That's why it's difficult to return, so...","person":"Maria Kirilenko"},{"question":"How surprised would you be if Serena didn't win the tournament?","answer":"Well, I don't care now, to be honest.","person":"Maria Kirilenko"}]}