{"sport":"Tennis","event":"Australian Open","date":"2013-01-16","people":[{"name":"Angelique Kerber","gender":"female"}],"text":"\n          \n            \n\t\t  AUSTRALIAN OPEN\n\t\t  \n\t\t  January 16, 2013\n\t\t  \n\t\t  Angelique Kerber\n\t\t  MELBOURNE, VICTORIA\n\t\t  A. KERBER/L. Hradecka\r\n  6‑3, 6‑1\r\n\r\nTHE MODERATOR:  Questions, please. \r\n\r\nQ.  How was that?  Looked pretty methodical and straightforward for you.  Happy with the win?\r\nANGELIQUE KERBER:  Yes, it was very hot today than the last match I played; was not so windy out there.  But she's a tough opponent, and you need to be ready for the whole match, because she's playing the ball very hard and deep in the court.\r\nSo I was just try moving very good and just play my game.  Yeah, I'm happy that I won the match in two sets.\r\n\r\nQ.  Obviously we saw you last year have a big breakthrough into the top 10.  Got couple of your first two big singles wins.  Your thoughts on this year, this Open, what you can do here?\r\nANGELIQUE KERBER:  I just look from round to round.\r\nI think the second week will be a good thing, but, I mean, it's the first Grand Slam and every player plays very well.\r\nI will just give my best, and we will see how far we will go.\r\n\r\nQ.  How much confidence did last year give you in terms of, you know, just overall with your career?  You must come into this year feeling very strong and upbeat about what you can do. \r\nANGELIQUE KERBER:  Of course I have a lot of confidence also from the last year.\r\nI beat a lot of good players and reached the top 10, top 5.  I'm just enjoy to be there where I am right now, and just having fun also on the court and off‑site. \r\nYeah, of course, I have a lot of confidence.\r\n\r\nQ.  Have you looked ahead to your next match?\r\nANGELIQUE KERBER:  Not yet because they are playing I think next round, so I don't know who I will play yet.  Yeah. \r\n\r\nFastScripts Transcript by ASAP Sports\r\n\r\n\r\n\r\n            \n          ","interview":[{"question":"How was that? Looked pretty methodical and straightforward for you. Happy with the win?","answer":"Yes, it was very hot today than the last match I played; was not so windy out there. But she's a tough opponent, and you need to be ready for the whole match, because she's playing the ball very hard and deep in the court.So I was just try moving very good and just play my game. Yeah, I'm happy that I won the match in two sets.","person":"Angelique Kerber"},{"question":"Obviously we saw you last year have a big breakthrough into the top 10. Got couple of your first two big singles wins. Your thoughts on this year, this Open, what you can do here?","answer":"I just look from round to round.I think the second week will be a good thing, but, I mean, it's the first Grand Slam and every player plays very well.I will just give my best, and we will see how far we will go.","person":"Angelique Kerber"},{"question":"How much confidence did last year give you in terms of, you know, just overall with your career? You must come into this year feeling very strong and upbeat about what you can do.","answer":"Of course I have a lot of confidence also from the last year.I beat a lot of good players and reached the top 10, top 5. I'm just enjoy to be there where I am right now, and just having fun also on the court and off‑site. Yeah, of course, I have a lot of confidence.","person":"Angelique Kerber"},{"question":"Have you looked ahead to your next match?","answer":"Not yet because they are playing I think next round, so I don't know who I will play yet. Yeah.","person":"Angelique Kerber"}]}