{"sport":"Tennis","event":"Australian Open","date":"2013-01-17","people":[{"name":"Juan Martin Del Potro","gender":"male"}],"text":"\n          \n            \n\t\t  AUSTRALIAN OPEN\n\t\t  \n\t\t  January 17, 2013\n\t\t  \n\t\t  Juan Martin Del Potro\n\t\t  MELBOURNE, VICTORIA\n\t\t  J. DEL POTRO/B. Becker\r\n  6‑2, 6‑4, 6‑2\r\n\r\nTHE MODERATOR:  Questions, please. \r\n\r\nQ.  Can you tell me if your height is an advantage for playing tennis or a disadvantage?\r\nJUAN MARTIN DEL POTRO:  No, I think is an advantage.  I'm very confidence with my serve, with my size, with my movements, and my size help me to serve or to find different ways of my serves. \r\nAnd I think all the tallest players are very dangerous in this kind of surface. \r\n\r\nQ.  Why don't you play more serve‑volley or go more often to the net?\r\nJUAN MARTIN DEL POTRO:  To the net?  I like to make winners on the baseline. \r\n\r\nQ.  Is your volley not so good?\r\nJUAN MARTIN DEL POTRO:  I'm working on my volley, but I'm confidence playing on the baseline with forehands and backhands.  But I know the way to beat the top guys is going to the net all the time, but I'm not playing against them yet. \r\n\r\nQ.  But your plan for the future is to go more to the net?\r\nJUAN MARTIN DEL POTRO:  Yeah, could be.  Yeah. \r\n\r\nFastScripts Transcript by ASAP Sports\r\n\r\n\r\n\r\n            \n          ","interview":[{"question":"Can you tell me if your height is an advantage for playing tennis or a disadvantage?","answer":"No, I think is an advantage. I'm very confidence with my serve, with my size, with my movements, and my size help me to serve or to find different ways of my serves. And I think all the tallest players are very dangerous in this kind of surface.","person":"Juan Martin Del Potro"},{"question":"Why don't you play more serve‑volley or go more often to the net?","answer":"To the net? I like to make winners on the baseline.","person":"Juan Martin Del Potro"},{"question":"Is your volley not so good?","answer":"I'm working on my volley, but I'm confidence playing on the baseline with forehands and backhands. But I know the way to beat the top guys is going to the net all the time, but I'm not playing against them yet.","person":"Juan Martin Del Potro"},{"question":"But your plan for the future is to go more to the net?","answer":"Yeah, could be. Yeah.","person":"Juan Martin Del Potro"}]}