{"sport":"Tennis","event":"Australian Open","date":"2013-01-17","people":[{"name":"Ayumi Morita","gender":"unknown"}],"text":"\n          \n            \n\t\t  AUSTRALIAN OPEN\n\t\t  \n\t\t  January 17, 2013\n\t\t  \n\t\t  Ayumi Morita\n\t\t  MELBOURNE, VICTORIA\n\t\t  A. MORITA/A. Beck\r\n  6‑2, 6‑0\r\n\r\nTHE MODERATOR:  Questions, please. \r\n\r\nQ.  You might play Serena Williams for the first time in the third round.  Can you talk about your thoughts going into that match? \r\nAYUMI MORITA:  Yes.\r\n\r\nQ.  Can you talk about your thoughts?\r\nAYUMI MORITA:  Yeah, she's of course great player and a great champion.  I just want to try my best out there.\r\nAnd I never played her, so, yeah, just go on the court and hope I can play well and enjoy the match.\r\n\r\nQ.  What are your goals for this year?  Do you have any ranking goals? \r\nAYUMI MORITA:  Sorry? \r\n\r\nQ.  You're now 72 in the world. \r\nAYUMI MORITA:  Yeah.\r\n\r\nQ.  Just wondering what your ranking goals are this year. \r\nAYUMI MORITA:  I hope I can get top 50 first, but I didn't play very well this year, so I just want to continue to play good in every match.\r\nYeah, I will see at the end of my year.\r\n\r\nFastScripts Transcript by ASAP Sports\r\n\r\n\r\n\r\n            \n          ","interview":[{"question":"You might play Serena Williams for the first time in the third round. Can you talk about your thoughts going into that match?","answer":"Yes.","person":"Ayumi Morita"},{"question":"Can you talk about your thoughts?","answer":"Yeah, she's of course great player and a great champion. I just want to try my best out there.And I never played her, so, yeah, just go on the court and hope I can play well and enjoy the match.","person":"Ayumi Morita"},{"question":"What are your goals for this year? Do you have any ranking goals?","answer":"Sorry?","person":"Ayumi Morita"},{"question":"You're now 72 in the world.","answer":"Yeah.","person":"Ayumi Morita"},{"question":"Just wondering what your ranking goals are this year.","answer":"I hope I can get top 50 first, but I didn't play very well this year, so I just want to continue to play good in every match.Yeah, I will see at the end of my year.","person":"Ayumi Morita"}]}